{
  "schema_version": "1.0",
  "episode_id": "cm-flagship-representation-to-evidence-v1",
  "chapter_id": "ch03-explicit-versus-ir",
  "order": 3,
  "title": "Explicit CM versus CM-IR",
  "purpose": "Distinguish the dense truth artifact from the canonical shared program.",
  "planned_duration_s": 60.0,
  "claim_ids": [
    "cm-explicit-definition",
    "cm-ir-definition",
    "dense-vs-ir-distinct",
    "variants-implemented",
    "no-universal-winner"
  ],
  "source_ids": [
    "src-cm-build",
    "src-cm-ir",
    "src-repo-readme",
    "src-bitset",
    "src-correction-report",
    "src-epfl-report"
  ],
  "renderer_brief": {
    "path": "episodes/cm-flagship-representation-to-evidence-v1/chapters/ch03-explicit-versus-ir/renderer_brief.json",
    "sha256": "19f5c103687a71fb9c84b4676c3fb4cde07e203218444993233dafb46b81cdcf"
  },
  "narration_cue_ids": [
    "ch03-explicit-versus-ir-01-1",
    "ch03-explicit-versus-ir-01-2",
    "ch03-explicit-versus-ir-02-1",
    "ch03-explicit-versus-ir-02-2",
    "ch03-explicit-versus-ir-03-1",
    "ch03-explicit-versus-ir-03-2"
  ],
  "dependencies": [
    "ch02-explicit-layout"
  ],
  "status": "passed",
  "cache_identity": "2541592cad6a903e7741d623c26f505448486d018eca525518ac45ae131462e4"
}
