{
  "schema_version": "1.0",
  "episode_id": "cm-flagship-representation-to-evidence-v1",
  "chapter_id": "ch02-explicit-layout",
  "order": 2,
  "title": "What the explicit matrix says",
  "purpose": "Explain live support, ambient variables, and the dense truth layout.",
  "planned_duration_s": 58.0,
  "claim_ids": [
    "cm-explicit-definition",
    "live-vs-ambient",
    "cm-ir-definition",
    "dense-vs-ir-distinct"
  ],
  "source_ids": [
    "src-cm-build",
    "src-cm-ir"
  ],
  "renderer_brief": {
    "path": "episodes/cm-flagship-representation-to-evidence-v1/chapters/ch02-explicit-layout/renderer_brief.json",
    "sha256": "8dd8f7471997083c4859a8ff125eb0430bf89499188d3c90623e7a70b5c5dd75"
  },
  "narration_cue_ids": [
    "ch02-explicit-layout-01-1",
    "ch02-explicit-layout-01-2",
    "ch02-explicit-layout-02-1",
    "ch02-explicit-layout-02-2",
    "ch02-explicit-layout-03-1",
    "ch02-explicit-layout-03-2"
  ],
  "dependencies": [
    "ch01-three-questions"
  ],
  "status": "passed",
  "cache_identity": "16c960ca1d63509ef6dc655d60b6b568eeef7a127d28db5878e7ce6e32f7db1e"
}
